{
  "ingredientId": "tuong-ot",
  "query": "sauce hot chile sriracha",
  "retrievedAt": "2026-10-21",
  "source": "usda-fdc",
  "totalHits": 362,
  "candidates": [
    {
      "rank": 1,
      "fdcId": 170106,
      "description": "Peppers, hot chili, red, raw",
      "dataType": "SR Legacy",
      "foodCategory": "Vegetables and Vegetable Products",
      "detailsUrl": "https://fdc.nal.usda.gov/food-details/170106/nutrients",
      "per100g": {
        "kcal": 40,
        "proteinG": 1.87,
        "fatG": 0.44,
        "carbG": 8.81,
        "fiberG": 1.5,
        "sodiumMg": 9
      },
      "kcalSource": "Energy",
      "missing": [],
      "reason": "SR Legacy (bảng cũ của USDA); mô tả có 'raw': nguyên liệu sống; đủ 6 chất; khớp 1/4 từ khoá."
    },
    {
      "rank": 2,
      "fdcId": 170497,
      "description": "Peppers, hot chili, green, raw",
      "dataType": "SR Legacy",
      "foodCategory": "Vegetables and Vegetable Products",
      "detailsUrl": "https://fdc.nal.usda.gov/food-details/170497/nutrients",
      "per100g": {
        "kcal": 40,
        "proteinG": 2,
        "fatG": 0.2,
        "carbG": 9.46,
        "fiberG": 1.5,
        "sodiumMg": 7
      },
      "kcalSource": "Energy",
      "missing": [],
      "reason": "SR Legacy (bảng cũ của USDA); mô tả có 'raw': nguyên liệu sống; đủ 6 chất; khớp 1/4 từ khoá."
    },
    {
      "rank": 3,
      "fdcId": 171186,
      "description": "Sauce, hot chile, sriracha",
      "dataType": "SR Legacy",
      "foodCategory": "Soups, Sauces, and Gravies",
      "detailsUrl": "https://fdc.nal.usda.gov/food-details/171186/nutrients",
      "per100g": {
        "kcal": 93,
        "proteinG": 1.93,
        "fatG": 0.93,
        "carbG": 19.2,
        "fiberG": 2.2,
        "sodiumMg": 2120
      },
      "kcalSource": "Energy",
      "missing": [],
      "reason": "SR Legacy (bảng cũ của USDA); mô tả không nói sống hay chín; đủ 6 chất; khớp 4/4 từ khoá."
    }
  ]
}
