{
  "ingredientId": "sau",
  "query": "dracontomelon sour fruit",
  "retrievedAt": "2026-10-21",
  "source": "usda-fdc",
  "totalHits": 583,
  "candidates": [
    {
      "rank": 1,
      "fdcId": 173954,
      "description": "Cherries, sour, red, raw",
      "dataType": "SR Legacy",
      "foodCategory": "Fruits and Fruit Juices",
      "detailsUrl": "https://fdc.nal.usda.gov/food-details/173954/nutrients",
      "per100g": {
        "kcal": 50,
        "proteinG": 1,
        "fatG": 0.3,
        "carbG": 12.2,
        "fiberG": 1.6,
        "sodiumMg": 3
      },
      "kcalSource": "Energy",
      "missing": [],
      "reason": "SR Legacy (bảng cũ của USDA); mô tả có 'raw': nguyên liệu sống; đủ 6 chất; khớp 1/3 từ khoá."
    },
    {
      "rank": 2,
      "fdcId": 169647,
      "description": "Candies, MARS SNACKFOOD US, STARBURST Sour Fruit Chews",
      "dataType": "SR Legacy",
      "foodCategory": "Sweets",
      "detailsUrl": "https://fdc.nal.usda.gov/food-details/169647/nutrients",
      "per100g": {
        "kcal": 400,
        "proteinG": 0.39,
        "fatG": 7.78,
        "carbG": 79.7,
        "fiberG": 0,
        "sodiumMg": 89
      },
      "kcalSource": "Energy",
      "missing": [],
      "reason": "SR Legacy (bảng cũ của USDA); mô tả không nói sống hay chín; đủ 6 chất; khớp 2/3 từ khoá."
    },
    {
      "rank": 3,
      "fdcId": 746774,
      "description": "Restaurant, Chinese, sweet and sour pork",
      "dataType": "Foundation",
      "foodCategory": "Restaurant Foods",
      "detailsUrl": "https://fdc.nal.usda.gov/food-details/746774/nutrients",
      "per100g": {
        "kcal": 260,
        "proteinG": 8.88,
        "fatG": 13.6,
        "carbG": 25.5,
        "fiberG": 1,
        "sodiumMg": 304
      },
      "kcalSource": "Energy",
      "missing": [],
      "reason": "Foundation Foods (số liệu phân tích mới của USDA); mô tả không nói sống hay chín; đủ 6 chất; khớp 1/3 từ khoá."
    }
  ]
}
