{
  "ingredientId": "rau-thom",
  "query": "Basil, fresh",
  "retrievedAt": "2026-10-21",
  "source": "usda-fdc",
  "totalHits": 320,
  "candidates": [
    {
      "rank": 1,
      "fdcId": 167811,
      "description": "Pork, fresh, backfat, raw",
      "dataType": "SR Legacy",
      "foodCategory": "Pork Products",
      "detailsUrl": "https://fdc.nal.usda.gov/food-details/167811/nutrients",
      "per100g": {
        "kcal": 812,
        "proteinG": 2.92,
        "fatG": 88.7,
        "carbG": 0,
        "fiberG": 0,
        "sodiumMg": 11
      },
      "kcalSource": "Energy",
      "missing": [],
      "reason": "SR Legacy (bảng cũ của USDA); mô tả có 'raw': nguyên liệu sống; đủ 6 chất; khớp 1/2 từ khoá."
    },
    {
      "rank": 2,
      "fdcId": 167812,
      "description": "Pork, fresh, belly, raw",
      "dataType": "SR Legacy",
      "foodCategory": "Pork Products",
      "detailsUrl": "https://fdc.nal.usda.gov/food-details/167812/nutrients",
      "per100g": {
        "kcal": 518,
        "proteinG": 9.34,
        "fatG": 53,
        "carbG": 0,
        "fiberG": 0,
        "sodiumMg": 32
      },
      "kcalSource": "Energy",
      "missing": [],
      "reason": "SR Legacy (bảng cũ của USDA); mô tả có 'raw': nguyên liệu sống; đủ 6 chất; khớp 1/2 từ khoá."
    },
    {
      "rank": 3,
      "fdcId": 167902,
      "description": "Pork, fresh, ground, raw",
      "dataType": "SR Legacy",
      "foodCategory": "Pork Products",
      "detailsUrl": "https://fdc.nal.usda.gov/food-details/167902/nutrients",
      "per100g": {
        "kcal": 263,
        "proteinG": 16.9,
        "fatG": 21.2,
        "carbG": 0,
        "fiberG": 0,
        "sodiumMg": 56
      },
      "kcalSource": "Energy",
      "missing": [],
      "reason": "SR Legacy (bảng cũ của USDA); mô tả có 'raw': nguyên liệu sống; đủ 6 chất; khớp 1/2 từ khoá."
    }
  ]
}
