{
  "ingredientId": "ca-chep",
  "query": "carp raw",
  "retrievedAt": "2026-10-21",
  "source": "usda-fdc",
  "totalHits": 1553,
  "candidates": [
    {
      "rank": 1,
      "fdcId": 171952,
      "description": "Fish, carp, raw",
      "dataType": "SR Legacy",
      "foodCategory": "Finfish and Shellfish Products",
      "detailsUrl": "https://fdc.nal.usda.gov/food-details/171952/nutrients",
      "per100g": {
        "kcal": 127,
        "proteinG": 17.8,
        "fatG": 5.6,
        "carbG": 0,
        "fiberG": 0,
        "sodiumMg": 49
      },
      "kcalSource": "Energy",
      "missing": [],
      "reason": "SR Legacy (bảng cũ của USDA); mô tả có 'raw': nguyên liệu sống; đủ 6 chất; khớp 2/2 từ khoá."
    },
    {
      "rank": 2,
      "fdcId": 747447,
      "description": "Broccoli, raw",
      "dataType": "Foundation",
      "foodCategory": "Vegetables and Vegetable Products",
      "detailsUrl": "https://fdc.nal.usda.gov/food-details/747447/nutrients",
      "per100g": {
        "kcal": 31,
        "proteinG": 2.57,
        "fatG": 0.34,
        "carbG": 6.27,
        "fiberG": 2.4,
        "sodiumMg": 36
      },
      "kcalSource": "Energy",
      "missing": [],
      "reason": "Foundation Foods (số liệu phân tích mới của USDA); mô tả có 'raw': nguyên liệu sống; đủ 6 chất; khớp 1/2 từ khoá."
    },
    {
      "rank": 3,
      "fdcId": 2685573,
      "description": "Cauliflower, raw",
      "dataType": "Foundation",
      "foodCategory": "Vegetables and Vegetable Products",
      "detailsUrl": "https://fdc.nal.usda.gov/food-details/2685573/nutrients",
      "per100g": {
        "kcal": 22.9,
        "proteinG": 1.64,
        "fatG": 0.238,
        "carbG": 4.72,
        "fiberG": 1.95,
        "sodiumMg": 20
      },
      "kcalSource": "Energy (Atwater Specific Factors)",
      "missing": [],
      "reason": "Foundation Foods (số liệu phân tích mới của USDA); mô tả có 'raw': nguyên liệu sống; đủ 6 chất; khớp 1/2 từ khoá; năng lượng lấy từ 'Energy (Atwater Specific Factors)'."
    }
  ]
}
