{
  "ingredientId": "bac-ha",
  "query": "taro stem raw",
  "retrievedAt": "2026-10-21",
  "source": "usda-fdc",
  "totalHits": 1561,
  "candidates": [
    {
      "rank": 1,
      "fdcId": 169308,
      "description": "Taro, raw",
      "dataType": "SR Legacy",
      "foodCategory": "Vegetables and Vegetable Products",
      "detailsUrl": "https://fdc.nal.usda.gov/food-details/169308/nutrients",
      "per100g": {
        "kcal": 112,
        "proteinG": 1.5,
        "fatG": 0.2,
        "carbG": 26.5,
        "fiberG": 4.1,
        "sodiumMg": 11
      },
      "kcalSource": "Energy",
      "missing": [],
      "reason": "SR Legacy (bảng cũ của USDA); mô tả có 'raw': nguyên liệu sống; đủ 6 chất; khớp 2/3 từ khoá."
    },
    {
      "rank": 2,
      "fdcId": 168487,
      "description": "Taro leaves, raw",
      "dataType": "SR Legacy",
      "foodCategory": "Vegetables and Vegetable Products",
      "detailsUrl": "https://fdc.nal.usda.gov/food-details/168487/nutrients",
      "per100g": {
        "kcal": 42,
        "proteinG": 4.98,
        "fatG": 0.74,
        "carbG": 6.7,
        "fiberG": 3.7,
        "sodiumMg": 3
      },
      "kcalSource": "Energy",
      "missing": [],
      "reason": "SR Legacy (bảng cũ của USDA); mô tả có 'raw': nguyên liệu sống; đủ 6 chất; khớp 2/3 từ khoá."
    },
    {
      "rank": 3,
      "fdcId": 2685576,
      "description": "Beets, raw",
      "dataType": "Foundation",
      "foodCategory": "Vegetables and Vegetable Products",
      "detailsUrl": "https://fdc.nal.usda.gov/food-details/2685576/nutrients",
      "per100g": {
        "kcal": 41,
        "proteinG": 1.69,
        "fatG": 0.302,
        "carbG": 8.79,
        "fiberG": 3.12,
        "sodiumMg": 112
      },
      "kcalSource": "Energy (Atwater Specific Factors)",
      "missing": [],
      "reason": "Foundation Foods (số liệu phân tích mới của USDA); mô tả có 'raw': nguyên liệu sống; đủ 6 chất; khớp 1/3 từ khoá; năng lượng lấy từ 'Energy (Atwater Specific Factors)'."
    }
  ]
}
