{
  "ingredientId": "bot-nang",
  "query": "Tapioca, pearl, dry",
  "retrievedAt": "2026-10-21",
  "source": "usda-fdc",
  "totalHits": 442,
  "candidates": [
    {
      "rank": 1,
      "fdcId": 2710828,
      "description": "Farro, pearled, dry, raw",
      "dataType": "Foundation",
      "foodCategory": "Cereal Grains and Pasta",
      "detailsUrl": "https://fdc.nal.usda.gov/food-details/2710828/nutrients",
      "per100g": {
        "kcal": 344,
        "proteinG": 12.6,
        "fatG": 3.1,
        "carbG": 72.1,
        "fiberG": 7.31,
        "sodiumMg": 0.845
      },
      "kcalSource": "Energy (Atwater Specific Factors)",
      "missing": [],
      "reason": "Foundation Foods (số liệu phân tích mới của USDA); mô tả có 'raw': nguyên liệu sống; đủ 6 chất; khớp 1/3 từ khoá; năng lượng lấy từ 'Energy (Atwater Specific Factors)'."
    },
    {
      "rank": 2,
      "fdcId": 2710840,
      "description": "Sorghum flour, white, pearled, unenriched, dry, raw",
      "dataType": "Foundation",
      "foodCategory": "Cereal Grains and Pasta",
      "detailsUrl": "https://fdc.nal.usda.gov/food-details/2710840/nutrients",
      "per100g": {
        "kcal": 350,
        "proteinG": 10.2,
        "fatG": 3.24,
        "carbG": 73.5,
        "fiberG": 3.3,
        "sodiumMg": 0
      },
      "kcalSource": "Energy (Atwater Specific Factors)",
      "missing": [],
      "reason": "Foundation Foods (số liệu phân tích mới của USDA); mô tả có 'raw': nguyên liệu sống; đủ 6 chất; khớp 1/3 từ khoá; năng lượng lấy từ 'Energy (Atwater Specific Factors)'."
    },
    {
      "rank": 3,
      "fdcId": 2710841,
      "description": "Sorghum grain, white, pearled, unenriched, dry, raw",
      "dataType": "Foundation",
      "foodCategory": "Cereal Grains and Pasta",
      "detailsUrl": "https://fdc.nal.usda.gov/food-details/2710841/nutrients",
      "per100g": {
        "kcal": 338,
        "proteinG": 10.2,
        "fatG": 3.26,
        "carbG": 74.9,
        "fiberG": 3.92,
        "sodiumMg": 0
      },
      "kcalSource": "Energy (Atwater Specific Factors)",
      "missing": [],
      "reason": "Foundation Foods (số liệu phân tích mới của USDA); mô tả có 'raw': nguyên liệu sống; đủ 6 chất; khớp 1/3 từ khoá; năng lượng lấy từ 'Energy (Atwater Specific Factors)'."
    }
  ]
}
