{
  "ingredientId": "mo-hanh",
  "query": "lard",
  "retrievedAt": "2026-10-21",
  "source": "usda-fdc",
  "totalHits": 5,
  "candidates": [
    {
      "rank": 1,
      "fdcId": 171401,
      "description": "Lard",
      "dataType": "SR Legacy",
      "foodCategory": "Fats and Oils",
      "detailsUrl": "https://fdc.nal.usda.gov/food-details/171401/nutrients",
      "per100g": {
        "kcal": 902,
        "proteinG": 0,
        "fatG": 100,
        "carbG": 0,
        "fiberG": 0,
        "sodiumMg": 0
      },
      "kcalSource": "Energy",
      "missing": [],
      "reason": "SR Legacy (bảng cũ của USDA); mô tả không nói sống hay chín; đủ 6 chất; khớp 1/1 từ khoá."
    },
    {
      "rank": 2,
      "fdcId": 167655,
      "description": "Frybread, made with lard (Apache)",
      "dataType": "SR Legacy",
      "foodCategory": "American Indian/Alaska Native Foods",
      "detailsUrl": "https://fdc.nal.usda.gov/food-details/167655/nutrients",
      "per100g": {
        "kcal": 309,
        "proteinG": 8.38,
        "fatG": 10.1,
        "carbG": 46,
        "fiberG": 1.7,
        "sodiumMg": 671
      },
      "kcalSource": "Energy",
      "missing": [],
      "reason": "SR Legacy (bảng cũ của USDA); mô tả không nói sống hay chín; đủ 6 chất; khớp 1/1 từ khoá."
    },
    {
      "rank": 3,
      "fdcId": 172327,
      "description": "Shortening, household, lard and vegetable oil",
      "dataType": "SR Legacy",
      "foodCategory": "Fats and Oils",
      "detailsUrl": "https://fdc.nal.usda.gov/food-details/172327/nutrients",
      "per100g": {
        "kcal": 900,
        "proteinG": 0,
        "fatG": 100,
        "carbG": 0,
        "fiberG": 0,
        "sodiumMg": 0
      },
      "kcalSource": "Energy",
      "missing": [],
      "reason": "SR Legacy (bảng cũ của USDA); mô tả không nói sống hay chín; đủ 6 chất; khớp 1/1 từ khoá."
    }
  ]
}
