{
  "ingredientId": "ca-basa",
  "query": "catfish channel farmed raw",
  "retrievedAt": "2026-10-21",
  "source": "usda-fdc",
  "totalHits": 1570,
  "candidates": [
    {
      "rank": 1,
      "fdcId": 175165,
      "description": "Fish, catfish, channel, farmed, raw",
      "dataType": "SR Legacy",
      "foodCategory": "Finfish and Shellfish Products",
      "detailsUrl": "https://fdc.nal.usda.gov/food-details/175165/nutrients",
      "per100g": {
        "kcal": 119,
        "proteinG": 15.2,
        "fatG": 5.94,
        "carbG": 0,
        "fiberG": 0,
        "sodiumMg": 98
      },
      "kcalSource": "Energy",
      "missing": [],
      "reason": "SR Legacy (bảng cũ của USDA); mô tả có 'raw': nguyên liệu sống; đủ 6 chất; khớp 4/4 từ khoá."
    },
    {
      "rank": 2,
      "fdcId": 174186,
      "description": "Fish, catfish, channel, wild, raw",
      "dataType": "SR Legacy",
      "foodCategory": "Finfish and Shellfish Products",
      "detailsUrl": "https://fdc.nal.usda.gov/food-details/174186/nutrients",
      "per100g": {
        "kcal": 95,
        "proteinG": 16.4,
        "fatG": 2.82,
        "carbG": 0,
        "fiberG": 0,
        "sodiumMg": 43
      },
      "kcalSource": "Energy",
      "missing": [],
      "reason": "SR Legacy (bảng cũ của USDA); mô tả có 'raw': nguyên liệu sống; đủ 6 chất; khớp 3/4 từ khoá."
    },
    {
      "rank": 3,
      "fdcId": 173715,
      "description": "Fish, salmon, coho, farmed, raw",
      "dataType": "SR Legacy",
      "foodCategory": "Finfish and Shellfish Products",
      "detailsUrl": "https://fdc.nal.usda.gov/food-details/173715/nutrients",
      "per100g": {
        "kcal": 160,
        "proteinG": 21.3,
        "fatG": 7.67,
        "carbG": 0,
        "fiberG": 0,
        "sodiumMg": 47
      },
      "kcalSource": "Energy",
      "missing": [],
      "reason": "SR Legacy (bảng cũ của USDA); mô tả có 'raw': nguyên liệu sống; đủ 6 chất; khớp 2/4 từ khoá."
    }
  ]
}
